{
  "schemaVersion": 1,
  "id": "ev_2026-07-20T07-39-45-122Z_7cebd849",
  "type": "human_playtest",
  "searchId": "s_20260720_lighthouse_in_a_storm",
  "nodeId": "n_0000_beam_rhythm",
  "objectiveRevision": 1,
  "createdAt": "2026-07-20T07:39:45.122Z",
  "session": {
    "id": "382b01f5-bc8e-48fa-8ebc-401988302926",
    "durationSeconds": 140.5,
    "restarts": 0,
    "completed": false
  },
  "ratings": {
    "fun": 4,
    "appeal": 4,
    "readability": 5,
    "fantasyFit": 4,
    "scopeConfidence": 5
  },
  "preserve": "Keep the visible timing window and the immediate beam response; the one-input loop reads instantly.",
  "change": "Add a little more rhythmic variation between flashes so success does not collapse into one repeated cadence.",
  "note": "The lighthouse silhouette, storm meter, and five-action limit create a complete readable micro-session without tutorial text.",
  "nextMove": "Cross the timing clarity with a resource tradeoff that makes each flash consequential.",
  "telemetry": [
    {
      "name": "first_input",
      "atMs": 48870
    },
    {
      "name": "decision",
      "atMs": 48871,
      "properties": {
        "points": 0,
        "attempt": 1
      }
    },
    {
      "name": "decision",
      "atMs": 49154,
      "properties": {
        "points": 10,
        "attempt": 2
      }
    },
    {
      "name": "decision",
      "atMs": 49429,
      "properties": {
        "points": 38,
        "attempt": 3
      }
    },
    {
      "name": "decision",
      "atMs": 49703,
      "properties": {
        "points": 0,
        "attempt": 4
      }
    },
    {
      "name": "decision",
      "atMs": 49987,
      "properties": {
        "points": 0,
        "attempt": 5
      }
    }
  ]
}
