{
  "schemaVersion": 1,
  "id": "ev_2026-07-20T22-06-54-273Z_f255b4af",
  "type": "human_playtest",
  "searchId": "s_20260720_jumpstorm_survivors",
  "nodeId": "n_0001_orbitbound",
  "objectiveRevision": 1,
  "createdAt": "2026-07-20T22:06:54.273Z",
  "session": {
    "id": "a667037a-eead-40e9-a46a-d51541a9cdb2",
    "durationSeconds": 8.2,
    "restarts": 0,
    "completed": false
  },
  "ratings": {
    "fun": 3
  },
  "preserve": "",
  "change": "",
  "note": "more challenging?",
  "telemetry": []
}
